College Code,college name ,sopc name ,spoc number ,Student counr,verified count
9535,V.P.MUTHAIAH PILLAI MEENAKSHI AMMAL ENGINEERING COLLEGE FOR WOMEN,Komalavalli,,36,36
9630,VINS CHRISTIAN  WOMEN'S COLLEGE OF ENGINEERING  CHUNKANKADI,Dr.V.DYANA CHRISTILDA,,31,31
9236,JAINEE COLLEGE OF ENGINEERING AND TECHNOLOGY,PRIYADHARSINI  M,,13,0
9625,RAJAS ENGINEERING COLLEGE,closed,,2,0
8218,SMR EAST COAST COLLEGE OF ENGINEERING AND TECHNOLOGY,D.PARTHIBAN,,11,10
9132,VICKRAM COLLEGE OF ENGINEERING,,,20,0
9107,K.L.N.COLLEGE OF INFORMATION TECHNOLOGY,HEMALATHA. B.K.,,87,87
5124,SARASWATHI VELU COLLEGE OF ENGINEERING,,,2,0
6207,GNANAMANI COLLEGE OF ENGINEERING,Merged with Gnanamani College of Technology (2624),,169,0
6236,INDIAN INSTITUTE OF HANDLOOM TECHNOLOGY,PRABAKARAN C,,138,138
8134,ROEVER COLLEGE OF ENGINEERING AND TECHNOLOGY,,,94,0
8150,DHANALAKSHMI SRINIVASAN INSTITUTE OF RESEARCH AND TECHNOLOGY,,,526,0
9102,CENTRAL ELECTROCHEMICAL RESEARCH INSTITUTE (CSIR) KARAIKUDI,B. Ramesh Babu ,,104,104
